{
  "schema": "polytwist.ideal-rigid-display-experiment.v1",
  "certificationSchema": "polytwist.ideal-rigid-display-certificate.v1",
  "valid": true,
  "protocol": {
    "seed": "ideal-rigid-phase1",
    "stateCount": 13,
    "progressSamples": [
      0,
      0.125,
      0.25,
      0.5,
      0.75,
      0.875,
      1
    ],
    "artifactIds": [
      "ghost-2",
      "classic-2",
      "ghost-3",
      "ghost-4",
      "axis-3",
      "bandaged-relay-3",
      "mirror-prism-3",
      "classic-3",
      "classic-4",
      "classic-5",
      "classic-6",
      "classic-7",
      "classic-8",
      "classic-9",
      "alien-a",
      "alien-b",
      "alien-c",
      "alien-d"
    ],
    "assertions": [
      "canonical affine artifact independently verifies",
      "docked exact state certifies",
      "every observed legal primitive move certifies at every animation sample",
      "active vertices preserve mechanism-axis coordinate",
      "committed turn certifies",
      "move followed by inverse restores the exact state",
      "canonical geometry hash is invariant under state and animation",
      "every primitive action is observed legal at least once",
      "bandaged artifacts expose at least one blocked action"
    ]
  },
  "summary": {
    "artifactCount": 18,
    "stateCount": 234,
    "dockedCertificates": 234,
    "legalMoveChecks": 1380,
    "blockedMoveObservations": 24,
    "animationCertificates": 9660,
    "committedTurnCertificates": 1380,
    "inverseRestorations": 1380
  },
  "failures": [],
  "artifacts": [
    {
      "artifactId": "ghost-2",
      "puzzleId": "ghost-2",
      "family": "tilted-frame-shapemod",
      "geometryHash": "9afcfc0bb1b9a398fa5e810bf13018e79153a059eb37b93007b28aa5df75b6c4",
      "sourceExactness": "rationalized-numerical",
      "logicalPieces": 8,
      "renderablePieces": 8,
      "bandageCount": 0,
      "scramble": [
        "D'",
        "B'",
        "D'",
        "R",
        "B'",
        "U",
        "B'",
        "D'",
        "R'",
        "B",
        "U2",
        "L2"
      ],
      "actionCoverage": {
        "R": {
          "legal": 13,
          "blocked": 0,
          "animationCertificates": 91
        },
        "L": {
          "legal": 13,
          "blocked": 0,
          "animationCertificates": 91
        },
        "U": {
          "legal": 13,
          "blocked": 0,
          "animationCertificates": 91
        },
        "D": {
          "legal": 13,
          "blocked": 0,
          "animationCertificates": 91
        },
        "F": {
          "legal": 13,
          "blocked": 0,
          "animationCertificates": 91
        },
        "B": {
          "legal": 13,
          "blocked": 0,
          "animationCertificates": 91
        }
      },
      "counts": {
        "stateCount": 13,
        "dockedCertificates": 13,
        "legalMoveChecks": 78,
        "blockedMoveObservations": 0,
        "animationCertificates": 546,
        "committedTurnCertificates": 78,
        "inverseRestorations": 78
      },
      "finalStateFingerprint": "lml1-0c1c57ad3b6909b2cb8c15781f3457ff"
    },
    {
      "artifactId": "classic-2",
      "puzzleId": "classic-2",
      "family": "orthogonal-cube",
      "geometryHash": "53e69b070d97a6aafe913b588ac9e6a93f9823c6aad58f4c95b4d091d8e2c0c1",
      "sourceExactness": "rationalized-numerical",
      "logicalPieces": 8,
      "renderablePieces": 8,
      "bandageCount": 0,
      "scramble": [
        "F'",
        "L'",
        "U2",
        "R",
        "B'",
        "L'",
        "B'",
        "L'",
        "U2",
        "F",
        "L",
        "D'"
      ],
      "actionCoverage": {
        "R": {
          "legal": 13,
          "blocked": 0,
          "animationCertificates": 91
        },
        "L": {
          "legal": 13,
          "blocked": 0,
          "animationCertificates": 91
        },
        "U": {
          "legal": 13,
          "blocked": 0,
          "animationCertificates": 91
        },
        "D": {
          "legal": 13,
          "blocked": 0,
          "animationCertificates": 91
        },
        "F": {
          "legal": 13,
          "blocked": 0,
          "animationCertificates": 91
        },
        "B": {
          "legal": 13,
          "blocked": 0,
          "animationCertificates": 91
        }
      },
      "counts": {
        "stateCount": 13,
        "dockedCertificates": 13,
        "legalMoveChecks": 78,
        "blockedMoveObservations": 0,
        "animationCertificates": 546,
        "committedTurnCertificates": 78,
        "inverseRestorations": 78
      },
      "finalStateFingerprint": "lml1-10c01e5ae1f0e004c6ee52bfea1ab87b"
    },
    {
      "artifactId": "ghost-3",
      "puzzleId": "ghost-3",
      "family": "tilted-frame-shapemod",
      "geometryHash": "205f4ebf27028e32b2aa77326d34b85c7c7e96670bc33ab9ea3cf3db1552afbe",
      "sourceExactness": "rationalized-numerical",
      "logicalPieces": 27,
      "renderablePieces": 26,
      "bandageCount": 0,
      "scramble": [
        "L2",
        "D'",
        "B'",
        "U'",
        "B2",
        "U2",
        "R",
        "B2",
        "D",
        "R'",
        "F'",
        "D'"
      ],
      "actionCoverage": {
        "R": {
          "legal": 13,
          "blocked": 0,
          "animationCertificates": 91
        },
        "L": {
          "legal": 13,
          "blocked": 0,
          "animationCertificates": 91
        },
        "U": {
          "legal": 13,
          "blocked": 0,
          "animationCertificates": 91
        },
        "D": {
          "legal": 13,
          "blocked": 0,
          "animationCertificates": 91
        },
        "F": {
          "legal": 13,
          "blocked": 0,
          "animationCertificates": 91
        },
        "B": {
          "legal": 13,
          "blocked": 0,
          "animationCertificates": 91
        }
      },
      "counts": {
        "stateCount": 13,
        "dockedCertificates": 13,
        "legalMoveChecks": 78,
        "blockedMoveObservations": 0,
        "animationCertificates": 546,
        "committedTurnCertificates": 78,
        "inverseRestorations": 78
      },
      "finalStateFingerprint": "lml1-252c5ace300ec02a773ab859677f08e4"
    },
    {
      "artifactId": "ghost-4",
      "puzzleId": "ghost-4",
      "family": "tilted-frame-shapemod",
      "geometryHash": "c229c2451067454729711a7835f7157c5439b440d8bfb548aa85704828e5027e",
      "sourceExactness": "rationalized-numerical",
      "logicalPieces": 64,
      "renderablePieces": 56,
      "bandageCount": 0,
      "scramble": [
        "F2",
        "L'",
        "F",
        "U2",
        "B",
        "U",
        "B2",
        "L2",
        "F'",
        "U",
        "B",
        "U"
      ],
      "actionCoverage": {
        "R": {
          "legal": 13,
          "blocked": 0,
          "animationCertificates": 91
        },
        "L": {
          "legal": 13,
          "blocked": 0,
          "animationCertificates": 91
        },
        "U": {
          "legal": 13,
          "blocked": 0,
          "animationCertificates": 91
        },
        "D": {
          "legal": 13,
          "blocked": 0,
          "animationCertificates": 91
        },
        "F": {
          "legal": 13,
          "blocked": 0,
          "animationCertificates": 91
        },
        "B": {
          "legal": 13,
          "blocked": 0,
          "animationCertificates": 91
        }
      },
      "counts": {
        "stateCount": 13,
        "dockedCertificates": 13,
        "legalMoveChecks": 78,
        "blockedMoveObservations": 0,
        "animationCertificates": 546,
        "committedTurnCertificates": 78,
        "inverseRestorations": 78
      },
      "finalStateFingerprint": "lml1-f5e8c6b9e4463ebe5442b13990257673"
    },
    {
      "artifactId": "axis-3",
      "puzzleId": "axis-3",
      "family": "diagonal-axis-shapemod",
      "geometryHash": "c4a00ee7ad58835f34fc2136d01a91a40c8662163a41c5e8c732296438deaa75",
      "sourceExactness": "rationalized-numerical",
      "logicalPieces": 27,
      "renderablePieces": 26,
      "bandageCount": 0,
      "scramble": [
        "R",
        "D",
        "F2",
        "U'",
        "L'",
        "F",
        "U'",
        "B2",
        "R2",
        "B",
        "D'",
        "F'"
      ],
      "actionCoverage": {
        "R": {
          "legal": 13,
          "blocked": 0,
          "animationCertificates": 91
        },
        "L": {
          "legal": 13,
          "blocked": 0,
          "animationCertificates": 91
        },
        "U": {
          "legal": 13,
          "blocked": 0,
          "animationCertificates": 91
        },
        "D": {
          "legal": 13,
          "blocked": 0,
          "animationCertificates": 91
        },
        "F": {
          "legal": 13,
          "blocked": 0,
          "animationCertificates": 91
        },
        "B": {
          "legal": 13,
          "blocked": 0,
          "animationCertificates": 91
        }
      },
      "counts": {
        "stateCount": 13,
        "dockedCertificates": 13,
        "legalMoveChecks": 78,
        "blockedMoveObservations": 0,
        "animationCertificates": 546,
        "committedTurnCertificates": 78,
        "inverseRestorations": 78
      },
      "finalStateFingerprint": "lml1-c89d0f855208ff2e899434ca6335d856"
    },
    {
      "artifactId": "bandaged-relay-3",
      "puzzleId": "bandaged-relay-3",
      "family": "state-dependent-bandaged-shapemod",
      "geometryHash": "175f86e7dc264ff0821ee475d103c8afa150da8158d215a19ea3a31f00722a09",
      "sourceExactness": "rationalized-numerical",
      "logicalPieces": 27,
      "renderablePieces": 26,
      "bandageCount": 2,
      "scramble": [
        "F2",
        "R",
        "U'",
        "F'",
        "D",
        "R",
        "U'",
        "B",
        "R2",
        "D'",
        "L",
        "B'"
      ],
      "actionCoverage": {
        "R": {